### ISSUE TITLE
Incorrect positions on the map.

### ISSUE THREAD

**Issue by Chalanero** [tananaev/traccar#3739]
I have a problem with the GPS103 trackers giving me incorrect positions on several occasions.

**Screenshot**
<a href="https://ibb.co/nFaiMw"><img src="https://preview.ibb.co/kfFTob/traccar.png" alt="traccar" border="0" /></a>

**The filters enabled are**
```xml
        <entry key='filter.enable'>true</entry>
        <entry key='filter.invalid'>true</entry>
        <entry key='filter.duplicate'>true</entry>
        <entry key='filter.maxSpeed'>250</entry>
```
**Report data**

1 | 2018-01-23 22:12:03 | -25,287293 | -57,658493 | 0 m | 27.0 km/h | -25.287293°, -57.658493° | sat=9  distance=155.59  totalDistance=162935.84  motion=true |  
-- | -- | -- | -- | -- | -- | -- | -- | --
1 | 2018-01-23 22:12:33 | -25,286332 | -57,659367 | 0 m | 16.0 km/h | -25.286332°, -57.659367° | sat=9  distance=138.51  totalDistance=163074.35  motion=true |  
0 | 2018-01-23 22:19:06 | -25,287059 | 57,659551 | 0 m | 0.0 km/h | -25.287059°, 57.659551° | sat=9  odometer=0  distance=1.108979546E7  totalDistance=1.12531534E7  motion=false |  
0 | 2018-01-23 22:21:07 | -25,287081 | 57,659542 | 0 m | 0.0 km/h | -25.287081°, 57.659542° | sat=10  odometer=0  distance=1.108979332E7  totalDistance=1.125315126E7  motion=false |  
0 | 2018-01-23 22:21:37 | -25,287070 | 57,659561 | 0 m | 0.0 km/h | -25.287070°, 57.659561° | sat=10  odometer=0  distance=1.108979559E7  totalDistance=1.125315353E7  motion=false |  

the valid and the not valid data are.
in the not valid, the length shows me with a positive value, I think that is the problem.

**My question is: what is the way to filter that data?**

**The filters enabled are** is this correct?
```xml
        <entry key='filter.enable'>true</entry>
        <entry key='filter.invalid'>true</entry>
        <entry key='filter.duplicate'>true</entry>
        <entry key='filter.maxSpeed'>250</entry>
```

**Comment by tananaev** [comment]
Looks like original data is invalid. It probably means that either device reported invalid data, or it was decoded incorrectly. I would need to see corresponding original HEX data to check.

**Comment by Chalanero** [comment]
￼

**Data I hear from port 5023**

21:06:47.840456 IP 190.104.131.216.49912 > manchester.5023: Flags [.], ack 21, win 8160, options [nop,nop,TS val 1979615 ecr 1579102766], length 0
	0x0000:  0000 ffff 0000 0000 0000 0000 0000 0800  ................
	0x0010:  4500 0034 b677 4000 6a06 b14e be68 83d8  E..4.w@.j..N.h..
	0x0020:  c034 a688 c2f8 139f 6a94 768f 4d26 8b76  .4......j.v.M&.v
	0x0030:  8010 1fe0 583c 0000 0101 080a 001e 34df  ....X<........4.
	0x0040:  5e1f 322e                                ^.2.
21:06:48.487687 IP server20.vox.com.py.45675 > manchester.5023: Flags [P.], seq 72:87, ack 21, win 10880, options [nop,nop,TS val 7844062 ecr 1579082373], length 15
	0x0000:  0000 ffff 0000 0000 0000 0000 0000 0800  ................
	0x0010:  4500 0043 6ee8 0000 6c06 9521 c9d9 1a15  E..Cn...l..!....
	0x0020:  c034 a688 b26b 139f 20c3 b238 722d 205c  .4...k.....8r-.\
	0x0030:  8018 2a80 6d48 0000 0101 080a 0077 b0de  ..*.mH.......w..
	0x0040:  5e1e e285 7878 0a13 4006 3f00 0105 8403  ^...xx..@.?.....
	0x0050:  e60d 0a                                  ...
21:06:48.488048 IP manchester.5023 > server20.vox.com.py.45675: Flags [P.], seq 21:31, ack 87, win 114, options [nop,nop,TS val 1579104432 ecr 7844062], length 10
	0x0000:  0004 ffff 0000 0000 0000 0000 0000 0800  ................
	0x0010:  4500 003e a163 4000 4006 4eab c034 a688  E..>.c@.@.N..4..
	0x0020:  c9d9 1a15 139f b26b 722d 205c 20c3 b247  .......kr-.\...G
	0x0030:  8018 0072 a1db 0000 0101 080a 5e1f 38b0  ...r........^.8.
	0x0040:  0077 b0de 7878 0513 0061 8af7 0d0a       .w..xx...a....
21:06:49.327832 IP server20.vox.com.py.45675 > manchester.5023: Flags [P.], seq 72:87, ack 21, win 10880, options [nop,nop,TS val 7844337 ecr 1579082373], length 15
	0x0000:  0000 ffff 0000 0000 0000 0000 0000 0800  ................
	0x0010:  4500 0043 6ee9 0000 6c06 9520 c9d9 1a15  E..Cn...l.......
	0x0020:  c034 a688 b26b 139f 20c3 b238 722d 205c  .4...k.....8r-.\
	0x0030:  8018 2a80 6c35 0000 0101 080a 0077 b1f1  ..*.l5.......w..
	0x0040:  5e1e e285 7878 0a13 4006 3f00 0105 8403  ^...xx..@.?.....
	0x0050:  e60d 0a                                  ...
21:06:49.327855 IP manchester.5023 > server20.vox.com.py.45675: Flags [.], ack 87, win 114, options [nop,nop,TS val 1579105272 ecr 7844337,nop,nop,sack 1 {72:87}], length 0
	0x0000:  0004 ffff 0000 0000 0000 0000 0000 0800  ................
	0x0010:  4500 0040 a164 4000 4006 4ea8 c034 a688  E..@.d@.@.N..4..
	0x0020:  c9d9 1a15 139f b26b 722d 2066 20c3 b247  .......kr-.f...G
	0x0030:  b010 0072 d758 0000 0101 080a 5e1f 3bf8  ...r.X......^.;.
	0x0040:  0077 b1f1 0101 050a 20c3 b238 20c3 b247  .w.........8...G
21:06:49.347656 IP server20.vox.com.py.45675 > manchester.5023: Flags [.], ack 31, win 10880, options [nop,nop,TS val 7844388 ecr 1579104432], length 0
	0x0000:  0000 ffff 0000 0000 0000 0000 0000 0800  ................
	0x0010:  4500 0034 6eea 0000 6c06 952e c9d9 1a15  E..4n...l.......
	0x0020:  c034 a688 b26b 139f 20c3 b247 722d 2066  .4...k.....Gr-.f
	0x0030:  8010 2a80 8c7d 0000 0101 080a 0077 b224  ..*..}.......w.$
	0x0040:  5e1f 38b0                                ^.8.
21:06:56.648276 IP server20.vox.com.py.45675 > manchester.5023: Flags [P.], seq 87:123, ack 31, win 10880, options [nop,nop,TS val 7845886 ecr 1579105272], length 36
	0x0000:  0000 ffff 0000 0000 0000 0000 0000 0800  ................
	0x0010:  4500 0058 6eeb 0000 6c06 9509 c9d9 1a15  E..Xn...l.......
	0x0020:  c034 a688 b26b 139f 20c3 b247 722d 2066  .4...k.....Gr-.f
	0x0030:  8018 2a80 ae89 0000 0101 080a 0077 b7fe  ..*..........w..
	0x0040:  5e1f 3bf8 7878 1f12 1201 1902 0636 c802  ^.;.xx.......6..
	0x0050:  b6d4 cc06 2fb2 a300 3800 02e8 0110 6f00  ..../...8.....o.
	0x0060:  4e4b 04b4 e34e 0d0a                      NK...N..
21:06:56.648313 IP manchester.5023 > server20.vox.com.py.45675: Flags [.], ack 123, win 114, options [nop,nop,TS val 1579112592 ecr 7845886], length 0
	0x0000:  0004 ffff 0000 0000 0000 0000 0000 0800  ................
	0x0010:  4500 0034 a165 4000 4006 4eb3 c034 a688  E..4.e@.@.N..4..
	0x0020:  c9d9 1a15 139f b26b 722d 2066 20c3 b26b  .......kr-.f...k
	0x0030:  8010 0072 90ad 0000 0101 080a 5e1f 5890  ...r........^.X.
	0x0040:  0077 b7fe                                .w..
21:06:56.648638 IP manchester.5023 > server20.vox.com.py.45675: Flags [P.], seq 31:41, ack 123, win 114, options [nop,nop,TS val 1579112593 ecr 7845886], length 10
	0x0000:  0004 ffff 0000 0000 0000 0000 0000 0800  ................
	0x0010:  4500 003e a166 4000 4006 4ea8 c034 a688  E..>.f@.@.N..4..
	0x0020:  c9d9 1a15 139f b26b 722d 2066 20c3 b26b  .......kr-.f...k
	0x0030:  8018 0072 22f3 0000 0101 080a 5e1f 5891  ...r".......^.X.
	0x0040:  0077 b7fe 7878 0512 0062 e2b0 0d0a       .w..xx...b....
21:06:57.588356 IP server20.vox.com.py.45675 > manchester.5023: Flags [.], ack 41, win 10880, options [nop,nop,TS val 7846156 ecr 1579112593], length 0
	0x0000:  0000 ffff 0000 0000 0000 0000 0000 0800  ................
	0x0010:  4500 0034 6eec 0000 6c06 952c c9d9 1a15  E..4n...l..,....
	0x0020:  c034 a688 b26b 139f 20c3 b26b 722d 2070  .4...k.....kr-.p
	0x0030:  8010 2a80 6586 0000 0101 080a 0077 b90c  ..*.e........w..
	0x0040:  5e1f 5891                                ^.X.

**Comment by tananaev** [comment]
Please provide Traccar logs.

**Comment by Chalanero** [comment]
I am new in this sorry if I do not understand the indications fast.
[https://www.dropbox.com/s/sm3fhz2sza4dzj6/tracker-server.log?dl=0](url)

**Comment by tananaev** [comment]
Please provide only corresponding messages from the log.

**Comment by Chalanero** [comment]
2018-01-24 00:54:15 DEBUG: [F296F809: 5023 < 201.217.26.30] HEX: 78781f1212011805360dc702b6925b062fa0ed00380002e801106f00273b00cdd93c0d0a
2018-01-24 00:54:15 DEBUG: [F296F809: 5023 > 201.217.26.30] HEX: 787805120004e4800d0a
2018-01-24 00:54:15  INFO: [F296F809] id: 352887076229016, time: 2018-01-24 00:52:12, lat: -25.28858, lon: 57.65812, speed: 0.0, course: 0.0
2018-01-24 00:54:28 DEBUG: [5C7D7F98: 5023 < 190.104.131.31] HEX: 78781f1212011805361ac702b69748062a585f00380002e80529ce0051c500ffb72d0d0a
2018-01-24 00:54:28 DEBUG: [5C7D7F98: 5023 > 190.104.131.31] HEX: 787805120027f7190d0a

2018-01-24 00:54:45 DEBUG: [F296F809: 5023 < 201.217.26.30] HEX: 78781f1212011805362bc702b6925c062fa0df00380002e801106f00273b00ce03280d0a
2018-01-24 00:54:45 DEBUG: [F296F809: 5023 > 201.217.26.30] HEX: 787805120005f5090d0a
2018-01-24 00:54:45  WARN: Geocoding failed - Empty address - GeocoderException (JsonGeocoder:69 < *:34 < *:96 < ...)
2018-01-24 00:54:45  INFO: [F296F809] id: 352887076229016, time: 2018-01-24 00:54:43, lat: -25.28858, lon: -57.65815, speed: 0.0, course: 0.0
2018-01-24 00:54:45  WARN: Empty address

2018-01-24 00:54:58 DEBUG: [5C7D7F98: 5023 < 190.104.131.31] HEX: 78781f12120118053638c702b6975a062a584b00380002e80529ce0051c5010020110d0a
2018-01-24 00:54:58 DEBUG: [5C7D7F98: 5023 > 190.104.131.31] HEX: 7878051200280fee0d0a

**Comment by tananaev** [comment]
What version of Traccar are you using? I am trying those messages on the latest source code and everything works fine.

**Comment by Chalanero** [comment]
I'm using traccar 3.15

**Comment by tananaev** [comment]
Then you should either wait for next release or build a version from source code.

**Comment by Chalanero** [comment]
of the reports could filter the invalid data?

**Comment by tananaev** [comment]
Max speed should be able to filter it.

**Comment by Chalanero** [comment]
in this way?

`<entry key='filter.enable'>true</entry>
<entry key='filter.maxSpeed'>250</entry>`

**Comment by tananaev** [comment]
Yes.

**Comment by Chalanero** [comment]
ok,Thank you
